{
  "id": "2d9f2f52-1a12-4b74-b7b8-56effa702131",
  "label": "Weekday wake-up",
  "local_time": "06:45:00",
  "time_zone": "America/Chicago",
  "weekdays": [1, 2, 3, 4, 5],
  "enabled": true,
  "sound": "sunrise",
  "volume": 0.72,
  "gradual_seconds": 300,
  "tags": ["work"],
  "generation": 4,
  "created_at": "2026-08-24T11:00:00Z",
  "updated_at": "2026-08-24T11:05:00Z"
}

